<?xml version="1.0"?>  
<!DOCTYPE unifiedTestConfiguration SYSTEM "http://www.hep.ucl.ac.uk/atlas/AtlasTesting/DTD/unifiedTestConfiguration.dtd">

<unifiedTestConfiguration>
<atn/>
<kv/>
<rtt xmlns="http://www.hep.ucl.ac.uk/atlas/AtlasTesting/rtt" >
  <rttContactPerson>Robert Harrington (roberth@NOSPAMbu.edu)</rttContactPerson>
  <mailto>roberth@NOSPAMbu.edu</mailto>
  <refRelease></refRelease>
  
  <jobList>
    <classification>
      <displayClass>OfflineValidation</displayClass>
      <displayProcess>Reco</displayProcess>
      <displayComponent>Det-Muon</displayComponent>
    </classification>
    
    <athena userJobId="MuonAlign_L3EC">
      <doc>Muon Alignment test</doc>
      <displayName>MdtGlobalChi2AlignAlgs_Reco_Test</displayName>
      <options>MuonAlignExample/runargs.ESDtoESD.py</options>
      <package>MuonSpectrometer/MuonAlignment/MuonAlignExample</package>
      <group>MuonAlignExample</group>
      <queue>medium</queue>
      <dataset>/castor/cern.ch/atlas/atlascerngroupdisk/det-muon/Bytestream2010/MuonBytestreamRun155697_selectedCbMu10Events_rec15.6.10.ESD.pool.root</dataset>
    </athena>
    
  </jobList>

  <jobGroups>
    <jobGroup name="AthenaMuonAlignExample" parent="Athena">
      <keepFilePattern> *.txt </keepFilePattern>
      <keepFilePattern> *.root </keepFilePattern>
      <keepFilePattern> *.ps </keepFilePattern>
      <keepFilePattern> *.gif </keepFilePattern>
      <keepFilePattern> *.log </keepFilePattern>
      <keepFilePattern> *.C </keepFilePattern>
      <keepFilePattern> *.py </keepFilePattern>
    </jobGroup>
  </jobGroups>
</rtt>
</unifiedTestConfiguration>
