<?xml version="1.0"?> 
<!DOCTYPE unifiedTestConfiguration SYSTEM "http://www.hep.ucl.ac.uk/atlas/AtlasTesting/DTD/unifiedTestConfiguration.dtd">

<unifiedTestConfiguration> 
  <!-- RTT tests -->
  <rtt xmlns="http://www.hep.ucl.ac.uk/atlas/AtlasTesting/rtt"> 
    <rttContactPerson>Stefano Camarda</rttContactPerson>
    <!--    <mailto>stefano.camarda@cern.ch</mailto> -->

    <!-- sj: This reference release was chosen until there is a stable release where it is possible to import "evgenConfig" -->
    <refRelease>rel_2, 2012-04-17</refRelease>

    <jobList>
      <classification>
        <displayClass>OfflineValidation</displayClass>
        <displayProcess>EvGen</displayProcess>
        <displayComponent>Athena-Core</displayComponent>
      </classification>
    </jobList>

    <jobGroups>
      <jobGroup name="HepMCAnalysis_i" parent="Athena">
	<!--Files produced by the job and that I want to keep in the results dir-->
        <keepFilePattern info="xml files" displayColor="blue">*.xml</keepFilePattern>
        <keepFilePattern info="python scripts" displayColor="red">*.py</keepFilePattern>
        <keepFilePattern info="txt files" displayColor="blue">*.txt</keepFilePattern>
        <keepFilePattern info="log files" displayColor="blue">*.log</keepFilePattern>
<!--        <keepFilePattern info="root scripts" displayColor="green">*.C</keepFilePattern> -->
<!--        <keepFilePattern info="root files" displayColor="grey">*.root</keepFilePattern> -->
<!--        <keepFilePattern info="java scripts" displayColor="green">*.jar</keepFilePattern> -->
        <keepFilePattern info="all log files" displayColor="blue">*log*</keepFilePattern>
	<!--Files that the post job needs-->
<!-- not really needed...
        <auxFilePattern>*.py</auxFilePattern>
        <auxFilePattern>*.xml</auxFilePattern>
        <auxFilePattern>*.txt</auxFilePattern>
-->        
        <testToRemove>
          <jobGroupName>RTT:Top</jobGroupName>
          <testidentifier>CheckFileRunner0</testidentifier>
        </testToRemove>
      </jobGroup>
    </jobGroups>
  
  </rtt> <!-- eof RTT tests -->
</unifiedTestConfiguration>
