<?xml version="1.0"?>
<!DOCTYPE unifiedTestConfiguration SYSTEM "http://www.hep.ucl.ac.uk/atlas/AtlasTesting/DTD/unifiedTestConfiguration.dtd">

<unifiedTestConfiguration>

<atn>
   <TEST name="AthenaPoolMultiTest" type="makecheck" suite="AthenaPoolMultiTest-Core">
      <timelimit>15</timelimit>
      <author> Jack Cranshaw </author>
      <mailto> cranshaw@anl.gov </mailto>
      <expectations>
         <errorMessage> FAILURE</errorMessage>
         <errorMessage> ERROR</errorMessage>
         <successMessage> check ok</successMessage>   
         <returnValue>0</returnValue>
      </expectations>
   </TEST>
</atn>
</unifiedTestConfiguration>
