<?xml version="1.0"?>
<!DOCTYPE unifiedTestConfiguration SYSTEM "http://www.hep.ucl.ac.uk/atlas/AtlasTesting/DTD/unifiedTestConfiguration.dtd">

<unifiedTestConfiguration>

<atn>
  <TEST name="LArCalib_Pedestal" type="athena" suite="LArElecCalib">
     <options_atn> -c 'doMonitoring=False; runAccumulator=False; doLArCalibDataQuality=True; GainList=["HIGH"]; PartitionType="EMB"; Partition="EB-EMBA"; PartitionTypeGeneric="EMBPS"; RunNumberList=[174585]; RunNumberFlag=int(RunNumberList[0]); InputDir=" "; FullFileName=["/afs/cern.ch/user/l/larcalib/w0/Test/data11_calib.00174585.calibration_LArElec-Pedestal-7s-High-BarrelPS.daq.RAW._lb0000._EB-EMBA._0001.data"]; GroupingType="ExtendedSubDetector" ' LArCalibProcessing/UseLArExtendedSubDetGrouping.py  LArCalibProcessing/LArCalib_PedestalAutoCorr_jobOptions.py LArCalibProcessing/LArCalib_PedestalAutoCorr_testing.py</options_atn>
     <timelimit>30</timelimit>
     <author> Pavol Strizenec </author>
     <mailto> pavol@mail.cern.ch </mailto>
     <expectations>
     </expectations>
  </TEST>
  <TEST name="LArCalib_Ramp" type="athena" suite="LArElecCalib">
     <options_atn> -c 'doMonitoring=False; doLArCalibDataQuality=True; CorrectBadChannels=True; ApplyAdHocCorrection=False; GainList=["HIGH"]; PartitionType="EMB"; Partition="EB-EMBA"; PartitionTypeGeneric="EMBPS"; RunNumberList=[174586]; RunNumberFlag=int(RunNumberList[0]); InputDir=" "; FullFileName=["/afs/cern.ch/user/l/larcalib/w0/Test/data11_calib.00174586.calibration_LArElec-Ramp-7s-High-BarrelPS.daq.RAW._lb0000._EB-EMBA._0001.data"]; GroupingType="ExtendedSubDetector" ' LArCalibProcessing/UseLArExtendedSubDetGrouping.py  LArCalibProcessing/LArCalib_Ramp_jobOptions.py LArCalibProcessing/LArCalib_Ramp_testing.py</options_atn>
     <timelimit>30</timelimit>
     <author> Pavol Strizenec </author>
     <mailto> pavol@mail.cern.ch </mailto>
     <expectations>
     </expectations>
  </TEST>
</atn>

</unifiedTestConfiguration>
