<?xml version="1.0"?>
<!DOCTYPE unifiedTestConfiguration SYSTEM "http://www.hep.ucl.ac.uk/atlas/AtlasTesting/DTD/unifiedTestConfiguration.dtd">

<unifiedTestConfiguration>

<atn>
<TEST name="CaloSimEx" type="athena" suite="CaloSimEx">
    <options_atn>CaloSimEx/CaloSimEx.py</options_atn>
    <timelimit>20</timelimit>
    <author>Emmanuel Le Guirriec</author>    
    <mailto>guirriec@cern.ch,toth@cppm.in2p3.fr</mailto>
    <package_atn>Calorimeter/CaloExample/CaloSimEx</package_atn>
    <expectations>
       <successMessage>Finalized successfully</successMessage>
    </expectations>
</TEST>
</atn>

<kv/>		

<rtt xmlns="http://www.hep.ucl.ac.uk/atlas/AtlasTesting/rtt">

<rttContactPerson>Emmanuel Le Guirriec</rttContactPerson>
<mailto>guirriec@cern.ch,toth@cppm.in2p3.fr</mailto>

<refRelease>10.0.1</refRelease>
   
<jobList>


  <classification>
       <displayClass>Development</displayClass>
       <displayProcess>Simul</displayProcess>
       <displayComponent>Det-LAr</displayComponent>
  </classification>

  <athena userJobId="CaloSimEx_RTT">
       <doc>single electrons,5 GeV,ATLAS_CSC_01_00_00,https://twiki.cern.ch/twiki/bin/view/Atlas/CaloIntegration</doc>
       <options>CaloSimEx_RTT.py</options>
       <package>Calorimeter/CaloExample/CaloSimEx</package>
       <group>CaloSimEx</group>
       <queue>medium</queue>
   </athena>

</jobList>
      
<jobGroups>
       <jobGroup name="CaloSimEx" parent="RTT:Athena">
       </jobGroup>
</jobGroups>

</rtt>

</unifiedTestConfiguration>
